ka,JP-rubi,JP-kanji,english,exa,EN-sentence,NP1,NP-sentence,JP-question,カンデルサイン,S1,S3,S5,S7,S2,S4,N2,N4,N6,N8,,,,,,,,,
562,くだり,下り,descent/going down,下りの電車は何番のホームから出ますか。,What platform number does the down train depart from?,ओरालो/तल जाने,तल जाने रेल कुन प्लेटफर्म नम्बरबाट जान्छ?,（　）の電車は何番のホームから出ますか,,,,,,,,,,,,,,,,,,,,
563,けいゆ,経由（する）,via,北京を経由して、モンゴルに行った。,I went to Mongolia via Beijing.,हुँदै,म बेइजिङ हुँदै मङ्गोलिया गएँ।,北京を（　）して、モンゴルに行った,,,,,,,,,,,,,,,,,,,,
564,こうくうき,航空機,aircraft/airplane,航空機は２０世紀になって発達した。,Aircraft were developed in the 20th century.,विमान,विमानको विकास बिसौं शताब्दीमा भएको थियो।,（　）は２０世紀になって発達した,,,,,,,,,,,,,,,,,,,,
565,こうそくどうろ,高速道路,freeway/motorway,空港までは、高速道路を使えば１時間です。,It'll take an hour to the airport if you use the freeway.,द्रुतमार्ग,यदि तपाईं द्रुतमार्गको प्रयोग गर्नुहुन्छ भने विमानस्थलसम्म पुग्न एक घण्टा लाग्नेछ।,空港までは、（　）を使えば１時間です,,,,,,,,,,,,,,,,,,,,
566,こうつうきかん,交通機関,means of transportation,大雪でほとんどの交通機関が止まっている。,Most means of transportation have stopped owing to the heavy snow.,यातायातका साधन,भारी हिमपातका कारण अधिकांश यातायातका साधनहरू बन्द छन्।,大雪でほとんどの（　）が止まっている,,,,,,,,,,,,,,,,,,,,
567,こうつうじこ,交通事故,traffic accident,トンネルの中で交通事故が起きた。,A traffic accident occurred in a tunnel.,सडक दुर्घटना,सुरुङभित्र एउटा सडक दुर्घटना भयो।,トンネルの中で（　）が起きた,,,,,,,,,,,,,,,,,,,,
568,ざせき,座席,seat,飛行機の座席は窓側を選んだ。,I chose a window seat on the plane.,सिट,मैले विमानमा झ्यालको छेउको सिट छानें।,飛行機の（　）は窓側を選んだ,,,,,,,,,,,,,,,,,,,,
569,シートベルト,,seatbelt,車に乗るときは、シートベルトをすること。,Fasten your seatbelt when you get in a car.,सुरक्षा पेटी,कारमा चढ्दा सुरक्षा पेटी बाँध्नुहोस्।,車に乗るときは、（　）をすること,,,,,,,,,,,,,,,,,,,,
570,じこくひょう,時刻表,timetable,時刻表で電車の出発時間を調べた。,I looked up the train departure times on the timetable.,समय तालिका,मैले समय तालिकामा रेलको प्रस्थान समय हेरें।,（　）で電車の出発時間を調べた,,,,,,,,,,,,,,,,,,,,
571,してつ,私鉄,private railroad/railway,次の駅で私鉄に乗り換えよう。,We'll transfer to a private railroad at the next station.,निजी रेलमार्ग,हामी अर्को स्टेशनमा निजी रेलमार्गमा सार्नेछौं।,次の駅で（　）に乗り換えよう,,,,,,,,,,,,,,,,,,,,
572,しゃこ,車庫,garage/depot,バス会社の車庫に長距離バスが並んでいる。,The long-distance buses are lined up in the bus company's depot.,गराज,लामो दूरीका बसहरू बस कम्पनीको गराजमा पंक्तिबद्ध छन्।,バス会社の（　）に長距離バスが並んでいる,,,,,,,,,,,,,,,,,,,,
573,じゅうたい,渋滞（する）,traffic congestion,事故があって、道が渋滞している。,There was an accident so the road's congested.,जाम,एउटा दुर्घटना भएकोले सडकमा जाम छ।,事故があって、道が（　）している,,,,,,,,,,,,,,,,,,,,
574,じょうしゃけん,乗車券,train/bus ticket,目的地までの乗車券を買った。,I bought a ticket to my destination.,टिकट,मैले मेरो गन्तव्यसम्मको टिकट किनें।,目的地までの（　）を買った,,,,,,,,,,,,,,,,,,,,
575,しんかんせん,新幹線,the Shinkansen/bullet train,京都へ行くには、新幹線が便利だ。,The Shinkansen is convenient for going to Kyoto.,शिन्कान्सेन (बुलेट ट्रेन),क्योटो जान शिन्कान्सेन सुविधाजनक छ।,京都へ行くには、（　）が便利だ,,,,,,,,,,,,,,,,,,,,
576,ストップ,,stop,急に前の車がストップした。,The car in front suddenly stopped.,रोक्नु,अगाडिको कार अचानक रोकियो।,急に前の車が（　）した,,,,,,,,,,,,,,,,,,,,
577,スピード,,speed,新幹線は時速３００キロ以上のスピードが出る。,The Shinkansen can get up to a speed of over 300 kilometers per hour.,गति,शिन्कान्सेन प्रति घण्टा ३०० किलोमिटरभन्दा बढीको गतिमा चल्न सक्छ।,新幹線は時速３００キロ以上の（　）が出る,,,,,,,,,,,,,,,,,,,,
578,そくど,速度,speed,道が狭いので、車の速度を落とした。,Because the road was narrow I reduced speed.,गति,सडक साँघुरो भएकोले मैले गाडीको गति कम गरें।,道が狭いので、車の（　）を落とした,,,,,,,,,,,,,,,,,,,,
579,タイヤ,,tire,雪道を走るので、特別なタイヤを付けた。,Because the car was running on snow-covered roads I attached special tires.,टायर,हिउँले ढाकिएको सडकमा गाडी चलाउनुपर्ने भएकोले मैले विशेष टायर लगाएँ।,雪道を走るので、特別な（　）を付けた,,,,,,,,,,,,,,,,,,,,
580,ちかみち,近道（する）,shortcut,駅までの近道を見付けた。,I found a shortcut to the station.,छोटो बाटो,मैले स्टेशनसम्मको छोटो बाटो फेला पारें।,駅までの（　）を見付けた,,,,,,,,,,,,,,,,,,,,
581,ちゅうしゃ,駐車（する）,parking,この道路は駐車できない。,You can't park on this road.,पार्किङ,यो सडकमा पार्किङ गर्न मिल्दैन।,この道路は（　）できない,,,,,,,,,,,,,,,,,,,,
582,つうか,通過（する）,passing,台風は夜中に関東地方を通過した。,The typhoon passed the Kanto region late at night.,पार गर्नु,आँधीले राति ढिलो कान्तो क्षेत्र पार गर्‍यो।,台風は夜中に関東地方を（　）した,,,,,,,,,,,,,,,,,,,,
583,つりかわ,つり革,hanging strap,電車が揺れるので、つり革につかまった。,Because the train was swaying I held onto the strap.,समात्ने ह्यान्डल,रेल हल्लिएकोले मैले समात्ने ह्यान्डल समातें।,電車が揺れるので、（　）につかまった,,,,,,,,,,,,,,,,,,,,
584,ていきけん,定期券,commuter pass,毎日電車に乗るなら、定期券のほうが安い。,If you're using the train every day a commuter pass is cheaper.,सिजन टिकट,यदि तपाईं हरेक दिन रेल चढ्नुहुन्छ भने सिजन टिकट सस्तो पर्छ।,毎日電車に乗るなら、（　）のほうが安い,,,,,,,,,,,,,,,,,,,,
595,ていしゃ,停車（する）,stopping,踏切の前では、一度停車するのが規則だ。,It is a rule to stop once before a railroad crossing.,रोकावट,,踏切の前では、一度（　）するのが規則だ,,,,,,,,,,,,,,,,,,,,
596,てつどう,鉄道,railroad,これは大陸を鉄道で移動するツアーです。,This is a tour traveling the continent by railroad.,रेलमार्ग,,これは大陸を（　）で移動するツアーです,,,,,,,,,,,,,,,,,,,,
597,とうちゃく,到着（する）,arrival,飛行機は予定の時間に到着した。,The plane arrived at the planned time.,पुगाइ,,飛行機は予定の時間に（　）した,,,,,,,,,,,,,,,,,,,,
598,どうろ,道路,road,この道路は朝も夕方も渋滞する。,This road is congested in the morning and the evening.,सडक,,この（　）は朝も夕方も渋滞する,,,,,,,,,,,,,,,,,,,,
599,ドライブ,,drive,山の中をドライブするのは気持ちがいい。,It feels good to drive in the mountains.,ड्राइभ,,山の中を（　）するのは気持ちがいい,,,,,,,,,,,,,,,,,,,,
600,ドライブイン,,roadside restaurant,疲れたから、ドライブインで休もう。,"As we’re tired, let’s take a rest at a roadside restaurant.",ढुंगो रेस्टुरेन्ट,,疲れたから、（　）で休もう,,,,,,,,,,,,,,,,,,,,
601,ナンバー,,number,犯人の車のナンバーを覚えていますか。,Do you remember the criminal’s car number?,गाडी नम्बर,,犯人の車の（　）を覚えていますか,,,,,,,,,,,,,,,,,,,,
602,のぼり,上り,ascent,次の上りの電車は何時に出ますか。,What time does the next up train depart?,चढाइ,,次の（　）の電車は何時に出ますか,,,,,,,,,,,,,,,,,,,,
603,はっしゃ,発車（する）,departure,このバスは５分後に発車します。,This bus will depart in five minutes.,प्रस्थान,,このバスは５分後に（　）します,,,,,,,,,,,,,,,,,,,,
604,パトカー,,patrol car,パトカーはスピード違反の車を追って行った。,The patrol car chased after a car for speeding.,गस्ती गाडी,,（　）はスピード違反の車を追って行った,,,,,,,,,,,,,,,,,,,,
605,ハンドル,,steering wheel,日本の車はハンドルが右側についている。,The steering wheel is on the right side in Japanese cars.,स्टीयरिङ,,日本の車は（　）が右側についている,,,,,,,,,,,,,,,,,,,,
606,びん,便,flight,午後の便で北海道へ行く。,I’ll go on the afternoon flight to Hokkaido.,उडान,,午後の（　）で北海道へ行く,,,,,,,,,,,,,,,,,,,,
607,ブレーキ,,brake,猫が飛び出して来たので、ブレーキを踏んだ。,"Because a cat dashed out, I stepped on the brakes.",ब्रेक,,猫が飛び出して来たので、（　）を踏んだ,,,,,,,,,,,,,,,,,,,,
608,ホーム,,platform,次の電車を待つ人がホームに並んでいる。,People waiting for the next train are lined up on the platform.,प्ल्याटफर्म,,次の電車を待つ人が（　）に並んでいる,,,,,,,,,,,,,,,,,,,,
609,ゆき/いき,行き,bound for,行き先は駅の掲示板で確認してください。,Please check the destination on the station bulletin board.,तर्फ जाने,,（　）先は駅の掲示板で確認してください,,,,,,,,,,,,,,,,,,,,
610,ラッシュ,,rush hour,ラッシュアワーは電車も駅も混んでいる。,"In the rush hour, both the trains and the stations are crowded.",व्यस्त समय,,（　）アワーは電車も駅も混んでいる,,,,,,,,,,,,,,,,,,,,
611,レール,,railway,モノレールはレールが一本しかない。,A monorail only has one rail,रेल मार्ग,,（　）はレールが一本しかない。,,,,,,,,,,,,,,,,,,,,
612,ダンプカー,,dump truck,,,डम्प ट्रक,,,,,,,,,,,,,,,,,,,,,,
613,トラック,,truck,,,ट्रक,,,,,,,,,,,,,,,,,,,,,,
614,ヘリコプター,,helicopter,,,हेलिकप्टर,,,,,,,,,,,,,,,,,,,,,,
615,ボート,,boat,,,नाव,,,,,,,,,,,,,,,,,,,,,,
616,モノレール,,monorail,,,एक पटरि रेल,,,,,,,,,,,,,,,,,,,,,,
617,ロケット,,rocket,,,रकेट,,,,,,,,,,,,,,,,,,,,,,
618,あせ,汗,sweat,暑くて、たくさん汗をかいた。,It was hot and I sweated a lot.,पसिना,,暑くて、たくさん（　）をかいた,,,,,,,,,,,,,,,,,,,,
619,アレルギー,,allergy,食べ物のアレルギーはありますか。,Do you have any food allergies?,एलर्जी,,食べ物の（　）はありますか,,,,,,,,,,,,,,,,,,,,
620,いいん,医院,clinic,内科の医院は、いつも混んでいる。,The internal medicine doctor’s office is always crowded.,क्लिनिक,,内科の（　）は、いつも混んでいる,,,,,,,,,,,,,,,,,,,,
621,いき,息,breath,今日は空気がきれいで、息が白い。,"The air is cold today, people’s breath is white.",सास,,今日は空気がきれいで、（　）が白い,,,,,,,,,,,,,,,,,,,,
622,いねむり,居眠り（する）,dozing off,事故の原因は運転手の居眠りだった。,The cause of the accident was the driver dozing off.,घुर्मुन्डो लाग्नु,,事故の原因は運転手の（　）だった,,,,,,,,,,,,,,,,,,,,
623,いのち,命,life,すぐ手術をすれば、この子の命は助けられる。,"If operated on immediately, this child’s life will be saved.",जीवन,,すぐ手術をすれば、この子の（　）は助けられる,,,,,,,,,,,,,,,,,,,,
624,インフルエンザ,,influenza,インフルエンザにかかって、高い熱が出た。,I had an influenza and got a high fever.,इन्फ्लुएन्जा,,（　）にかかって、高い熱が出た,,,,,,,,,,,,,,,,,,,,
625,ウイルス,,virus,風邪の原因はたいていウイルスが関係している。,The cause of the cold is mostly a virus.,भाइरस,,風邪の原因はたいてい（　）が関係している,,,,,,,,,,,,,,,,,,,,
626,うがい,,gargle,家に帰ったら、必ずうがいをする。,I always gargle when I get home.,गर्जनु,,家に帰ったら、必ず（　）をする,,,,,,,,,,,,,,,,,,,,
627,かおり,香り,scent,この石けんは花の香りがする。,This soap has a flower scent.,सुगन्ध,,この石けんは花の（　）がする,,,,,,,,,,,,,,,,,,,,
628,かふんしょう,花粉症,hay fever,春は花粉症に苦しむ人が多い。,Many people suffer from hay fever in the spring.,फूलको एलर्जी,,春は（　）に苦しむ人が多い,,,,,,,,,,,,,,,,,,,,
629,かみのけ,髪の毛,hair,暑くなったので、髪の毛を短く切った。,"Because it’s hot, I cut my hair short.",कपाल,,暑くなったので、（　）を短く切った,,,,,,,,,,,,,,,,,,,,
630,がん,,cancer,１年に１度、がんの検査を受けている。,I undergo a cancer examination once a year.,क्यान्सर,,１年に１度、（　）の検査を受けている,,,,,,,,,,,,,,,,,,,,
631,かんじゃ,患者,patient,冬になると、インフルエンザの患者が増える。,"When winter comes, the number of influenza patients increases.",रोगी,,冬になると、インフルエンザの（　）が増える,,,,,,,,,,,,,,,,,,,,
632,きず,傷,wound,指の傷が、なかなか治らない。,The wound on my finger is not healing.,घाउ,,指の（　）が、なかなか治らない,,,,,,,,,,,,,,,,,,,,
633,きゅうびょう,急病,sudden illness,家族の急病で、仕事を休んだ。,"Because of a family member's sudden illness, I took a day off.",अचानक बिरामी,,家族の（　）で、仕事を休んだ,,,,,,,,,,,,,,,,,,,,
634,きんえん,禁煙（する）,no smoking,健康のことを考えて、禁煙した。,I thought about my health and gave up smoking.,धुम्रपान निषेध,,健康のことを考えて、（　）した,,,,,,,,,,,,,,,,,,,,
635,きんし,禁止（する）,prohibition,この公園では野球やゴルフは禁止している。,Baseball and golf are banned in this park.,प्रतिबन्ध,,この公園では野球やゴルフは（　）している,,,,,,,,,,,,,,,,,,,,
636,くしゃみ,,sneeze,花粉症でくしゃみが止まらない。,I can’t stop sneezing because of hay fever.,छ्याँक,,花粉症で（　）が止まらない,,,,,,,,,,,,,,,,,,,,
637,けつあつ,血圧,blood pressure,血圧が高いので、食べ物に気を付けている。,"Because my blood pressure is high, I am being careful about what I eat.",रक्तचाप,,（　）が高いので、食べ物に気を付けている,,,,,,,,,,,,,,,,,,,,
638,けつえき,血液,blood,血液の検査を受けて、病気が分かった。,"After the blood test, I found out what the disease was.",रगत,,（　）の検査を受けて、病気が分かった,,,,,,,,,,,,,,,,,,,,
639,げり,下痢,diarrhea,古い魚を食べて、下痢をした。,I got diarrhea from eating fish that was off.,पातलो दिसा,,古い魚を食べて、（　）をした,,,,,,,,,,,,,,,,,,,,
640,けんこう,健康,health,健康のために、私は毎日３０分歩いている。,"For my health, I walk 30 minutes a day.",स्वास्थ्य,,（　）のために、私は毎日３０分歩いている,,,,,,,,,,,,,,,,,,,,
641,けんさ,検査（する）,examination,毎年、血の検査をしている。,I get a blood test every year.,परीक्षण,,毎年、血の（　）をしている,,,,,,,,,,,,,,,,,,,,
642,こきゅう,呼吸（する）,breathing,魚は水の中でだけ呼吸ができる。,Fish can only breathe in water.,सास फेर्नु,,魚は水の中でだけ（　）ができる,,,,,,,,,,,,,,,,,,,,
643,こっせつ,骨折（する）,fracture,スキーで転んで、足を骨折した。,I fell when skiing and broke my leg.,हड्डी भाँचिनु,,スキーで転んで、足を（　）した,,,,,,,,,,,,,,,,,,,,
644,コンタクト,,contact lens,寝るときは、コンタクトを外す。,"When I go to bed, I take out my contacts.",कन्ट्याक्ट लेन्स,,寝るときは、（　）を外す,,,,,,,,,,,,,,,,,,,,
645,しぼう,死亡（する）,death,交通事故で死亡する人は減ってきた。,The number of people who died in traffic accidents is decreasing.,मृत्यु,,交通事故で（　）する人は減ってきた,,,,,,,,,,,,,,,,,,,,
646,しゅじゅつ,手術（する）,surgery,父は病気で手術を受けた。,My father had an operation because of illness.,शल्यक्रिया,,父は病気で（　）を受けた,,,,,,,,,,,,,,,,,,,,
647,しゅっけつ,出血（する）,bleeding,出血がひどかったので、病院へ行った。,"Because the bleeding was terrible, I went to the hospital.",रगत बग्ने,,（　）がひどかったので、病院へ行った,,,,,,,,,,,,,,,,,,,,
648,しょうじょう,症状,symptom,薬を飲んだら、風邪の症状が軽くなった。,The symptoms of my cold improved after I took medicine.,लक्षण,,薬を飲んだら、風邪の（　）が軽くなった,,,,,,,,,,,,,,,,,,,,
649,しょうどく,消毒（する）,sterilization,医者は患者の手を消毒する。,The doctor disinfects his patient’s hands.,जिवाणु मार्ने,,医者は患者の手を（　）する,,,,,,,,,,,,,,,,,,,,
650,しょくちゅうどく,食中毒,food poisoning,夏は食中毒に注意しなければならない。,"In summer, be careful of food poisoning.",खाद्य विषाक्तता,,夏は（　）に注意しなければならない,,,,,,,,,,,,,,,,,,,,
651,しょくよく,食欲,appetite,病気が治って、食欲が戻ってきた。,I got better and my appetite came back.,भोक,,病気が治って、（　）が戻ってきた,,,,,,,,,,,,,,,,,,,,
652,しらが,白髪,gray hair,父は最近、白髪が急に増えた。,My father’s gray hair suddenly increased.,सेतो कपाल,,父は最近、（　）が急に増えた,,,,,,,,,,,,,,,,,,,,
653,しんけい,神経,nerve,歯の神経を抜くことになった。,The nerve in my tooth is going to be removed.,स्नायु,,歯の（　）を抜くことになった,,,,,,,,,,,,,,,,,,,,
654,しんさつ,診察（する）,consultation,風邪が続くので、病院で診察をしてもらった。,"As the cold continued, I had an examination at the hospital.",जाँच,,風邪が続くので、病院で（　）をしてもらった,,,,,,,,,,,,,,,,,,,,
655,しんだんしょ,診断書,medical certificate,この保険に入るには、医師の診断書が要る。,"To apply for this insurance, you need a medical certificate from a doctor.",चिकित्सा प्रमाणपत्र,,この保険に入るには、医師の（　）が要る,,,,,,,,,,,,,,,,,,,,
656,しんちょう,身長,height,私の弟は背が高くて、身長は１８５センチだ。,My little brother is the tallest in our family.,उचाइ,,私の弟は背が高くて、（　）は１８５センチだ,,,,,,,,,,,,,,,,,,,,
657,すいみん,睡眠,sleep,明日のために、睡眠を十分取って休もう。,Let’s get a good night’s sleep for tomorrow.,निन्द्रा,,明日のために、（　）を十分取って休もう,,,,,,,,,,,,,,,,,,,,
658,ずつう,頭痛,headache,頭痛がするので、薬を飲んだ。,"Because I had a headache, I took medicine.",टाउको दुखाइ,,（　）がするので、薬を飲んだ,,,,,,,,,,,,,,,,,,,,
659,ストレス,,stress,ストレスをためるのは体によくない。,The build up of stress is not good for your body.,तनाव,,（　）をためるのは体によくない,,,,,,,,,,,,,,,,,,,,
660,せき,,cough,今流行している風邪は、せきがひどいらしい。,The cold going around now seems to bring a terrible cough.,खोकी,,今流行している風邪は、（　）がひどいらしい,,,,,,,,,,,,,,,,,,,,
661,ダイエット,,diet,ダイエットをして、３キロやせた。,I dieted and lost three kilograms.,आहार,,（　）をして、３キロやせた,,,,,,,,,,,,,,,,,,,,
662,たいおん,体温,body temperature,体温を測ったら、３９度もあった。,"When I took my temperature, it was 39 degrees.",शरीरको तापक्रम,,（　）を測ったら、３９度もあった,,,,,,,,,,,,,,,,,,,,
663,たいじゅう,体重,body weight,食べ過ぎで体重が３キロも増えてしまった。,I ate too much and my weight increased by three kilograms.,तौल,,食べ過ぎで（　）が３キロも増えてしまった,,,,,,,,,,,,,,,,,,,,
664,たいりょく,体力,physical strength,体力が落ちて、最近風邪を引きやすい。,"My physical strength has declined, and recently I catch colds easily.",शारीरिक शक्ति,,（　）が落ちて、最近風邪を引きやすい,,,,,,,,,,,,,,,,,,,,
665,つかれ,疲れ,tiredness,疲れを取って、翌日がんばれるように。,Rest up so you’ll feel better the next day.,थकाइ,,（　）を取って、翌日がんばれるように,,,,,,,,,,,,,,,,,,,,
666,ながいき,長生き（する）,long life,「祖母は１００歳で長生きですね」,Your grandmother is living to a ripe old age.,दीर्घ जीवन,,「祖母は１００歳で（　）ですね」,,,,,,,,,,,,,,,,,,,,
667,なみだ,涙,tears,朝から目がかゆくて、涙が出る。,"Since this morning, my eyes are itchy and water.",आँसु,,朝から目がかゆくて、（　）が出る,,,,,,,,,,,,,,,,,,,,
668,におい,匂い／臭い,smell,この花は、いい匂いがする。,This flower has a nice smell.,गन्ध,,この花は、（　）,,,,,,,,,,,,,,,,,,,,
669,はきけ,吐き気,nausea,おなかが痛いし、吐き気もしてつらい。,I feel terrible because I have a stomachache and nausea.,वाकवाकी,,おなかが痛いし、（　）もしてつらい,,,,,,,,,,,,,,,,,,,,
670,はだ,肌,skin,赤ちゃんの肌は、とても柔らかい。,Babies’ skin is very soft.,छाला,,赤ちゃんの（　）は、とても柔らかい,,,,,,,,,,,,,,,,,,,,
671,はだか,裸,naked,日本では裸で温泉に入る。,In Japan people get into hot springs in the nude.,नाङ्गो,,日本では（　）で温泉に入る,,,,,,,,,,,,,,,,,,,,
672,がんか,眼科,ophthalmology,,,नेत्र रोग,,,,,,,,,,,,,,,,,,,,,,
673,げか,外科,surgery,,,शल्यक्रिया,,,,,,,,,,,,,,,,,,,,,,
674,さんふじんか,産婦人科,obstetrics and gynecology,,,प्रसूति तथा स्त्री रोग,,,,,,,,,,,,,,,,,,,,,,
675,しか,歯科,dentistry,,,दन्त रोग,,,,,,,,,,,,,,,,,,,,,,
676,じびか,耳鼻科,otorhinolaryngology,,,नाक-कान-घाँटी,,,,,,,,,,,,,,,,,,,,,,
677,しょうにか,小児科,pediatrics,,,बालरोग,,,,,,,,,,,,,,,,,,,,,,
678,せいけいげか,整形外科,orthopedic surgery,,,अस्थिरोग,,,,,,,,,,,,,,,,,,,,,,
679,ないか,内科,internal medicine,,,आन्तरिक औषधि,,,,,,,,,,,,,,,,,,,,,,
